{
  "bundle_id": "2ea0c65f-a7d2-409f-9769-cb35b07edc49",
  "bundle_version": "0.2.0",
  "run_id": "run-1",
  "status": "reconstruction_complete",
  "generated_at": "2026-10-05T22:44:45.157189+00:00",
  "producer_profiles": [
    {
      "profile_id": "control-plane-bounded-run@28350065",
      "producer": "Cognous Agent Control Plane",
      "repository": "cogno-us/cognous-agent-control-plane",
      "revision": "283500652d47a692fb0b99a1172a6d5faffbd9a7",
      "format_name": "BoundedRunRecord",
      "format_version": null,
      "schema_ref": null,
      "notes": "No embedded format version; adapter is revision-pinned."
    },
    {
      "profile_id": "moltbot-safe-envelope-0.2.0@6b0ba118",
      "producer": "Moltbot Safe",
      "repository": "cogno-us/moltbot-safe",
      "revision": "6b0ba1185bcd390f71df947dda349415e4105f5f",
      "format_name": "ExecutionEnvelope + SQLite evidence",
      "format_version": "0.2.0",
      "schema_ref": null,
      "notes": "Synthetic local destination evidence; not independent institutional verification."
    }
  ],
  "records": [
    {
      "record_id": "control-plane-bounded-run@28350065:runtime_proposal:0",
      "producer_profile_id": "control-plane-bounded-run@28350065",
      "record_type": "runtime_proposal",
      "source_sequence": 0,
      "source_path": "proposal",
      "recorded_at": null,
      "identifiers": {
        "run_id": "run-1",
        "correlation_id": "case-1",
        "action_id": "urn:cognous:action:refund-issue-routine-v1",
        "manifest_id": "refund-integration-pilot-v1",
        "authority_context_profile_ref": "urn:cognous:alvorada:public-stack-profile:0.1.0",
        "requirement_id": "urn:cognous:authority-requirement:refund-routine-v1"
      },
      "evidence_class": "producer_reported",
      "data": {
        "manifest_id": "refund-integration-pilot-v1",
        "manifest_version": "1.1",
        "manifest_digest": "sha256:4d1ad6c96bc242c63998231b4df3ad7c86dc2e5e59cdae63afe7bff86e60f6ac",
        "actor": "urn:cognous:identity:refund-agent-1",
        "principal": "urn:cognous:principal:refund-service",
        "action_id": "urn:cognous:action:refund-issue-routine-v1",
        "adapter_id": "urn:cognous:adapter:synthetic-refund-v1",
        "target": "urn:cognous:synthetic-account:customer-001",
        "payload": {
          "customer_id": "customer-001",
          "refund_reason": "duplicate"
        },
        "payload_commitment": "sha256:6b782ebbcc034edeca4069b31aa4d8cbc9d3eeaf3b2034ab989bb430de962c0e",
        "requested_permissions": [
          "refund.issue.routine"
        ],
        "amount": 50.0,
        "unit": "USD",
        "effects": 1,
        "authority_context_ref": "urn:cognous:alvorada:public-stack-profile:0.1.0",
        "requirement_id": "urn:cognous:authority-requirement:refund-routine-v1",
        "risk_metadata": {},
        "not_before": null,
        "expires_at": null,
        "correlation_id": "case-1",
        "run_id": "run-1",
        "expected_side_effects": [],
        "evidence_refs": [
          "urn:cognous:evidence:refund-entitlement"
        ]
      }
    },
    {
      "record_id": "control-plane-bounded-run@28350065:runtime_decision:1",
      "producer_profile_id": "control-plane-bounded-run@28350065",
      "record_type": "runtime_decision",
      "source_sequence": 1,
      "source_path": "decisions[0]",
      "recorded_at": "2026-10-05T19:00:00+00:00",
      "identifiers": {
        "run_id": "run-1",
        "decision_id": "cdc218d9-cd8f-44ac-a786-8d4a1f28eec1",
        "effect_id": "sha256:d19d83b15e0ec164f3da356fe7a1ecef64734724d7fd65265e91e95f2ffe2829",
        "manifest_id": "refund-integration-pilot-v1",
        "action_id": "urn:cognous:action:refund-issue-routine-v1",
        "grant_id": "urn:cognous:grant:routine-1",
        "grant_revision": "1",
        "authority_context_instance_id": "urn:cognous:authority-context:pilot-1",
        "requirement_id": "urn:cognous:authority-requirement:refund-routine-v1"
      },
      "evidence_class": "producer_reported",
      "data": {
        "decision_id": "cdc218d9-cd8f-44ac-a786-8d4a1f28eec1",
        "effect_id": "sha256:d19d83b15e0ec164f3da356fe7a1ecef64734724d7fd65265e91e95f2ffe2829",
        "result": "authorized",
        "reasons": [],
        "decided_at": "2026-10-05T19:00:00+00:00",
        "binding": {
          "proposal_commitment": "sha256:133c4baa21d85e41ae7f75af45a96810aa1a175ee3e693913585568630aea96b",
          "manifest_id": "refund-integration-pilot-v1",
          "manifest_version": "1.1",
          "manifest_digest": "sha256:4d1ad6c96bc242c63998231b4df3ad7c86dc2e5e59cdae63afe7bff86e60f6ac",
          "actor": "urn:cognous:identity:refund-agent-1",
          "principal": "urn:cognous:principal:refund-service",
          "action_id": "urn:cognous:action:refund-issue-routine-v1",
          "adapter_id": "urn:cognous:adapter:synthetic-refund-v1",
          "target": "urn:cognous:synthetic-account:customer-001",
          "payload_commitment": "sha256:6b782ebbcc034edeca4069b31aa4d8cbc9d3eeaf3b2034ab989bb430de962c0e",
          "requested_permissions": [
            "refund.issue.routine"
          ],
          "amount": 50.0,
          "unit": "USD",
          "effects": 1,
          "authority_context_id": "urn:cognous:authority-context:pilot-1",
          "authority_context_version": "0.1.0",
          "authority_context_status": "proposed_pending_governor_review",
          "requirement_id": "urn:cognous:authority-requirement:refund-routine-v1",
          "requirement_commitment": "sha256:6590406e701b51e637c87953860d1ceb72d8da0af87311048f152e0ee2b8ccb6",
          "grant_id": "urn:cognous:grant:routine-1",
          "grant_revision": "1",
          "policy_versions": [
            {
              "ref": "urn:cognous:policy:refund-policy",
              "version": "1.0"
            }
          ],
          "role_mapping_version": "roles-v1",
          "role_mapping_digest": "sha256:f8a8db156df7087ddf34be1ed77fc86fa20ba7668deb87a9b3a5bd0a6ace496d",
          "effective_max_effects": 1
        }
      }
    },
    {
      "record_id": "control-plane-bounded-run@28350065:control_plane_attempt_transition:2",
      "producer_profile_id": "control-plane-bounded-run@28350065",
      "record_type": "control_plane_attempt_transition",
      "source_sequence": 2,
      "source_path": "attempts[0]",
      "recorded_at": "2026-10-05T19:00:00+00:00",
      "identifiers": {
        "run_id": "run-1",
        "attempt_id": "2174c9ea-5d90-428e-b849-a912f5f21f79",
        "effect_id": "sha256:d19d83b15e0ec164f3da356fe7a1ecef64734724d7fd65265e91e95f2ffe2829",
        "decision_id": "cdc218d9-cd8f-44ac-a786-8d4a1f28eec1"
      },
      "evidence_class": "producer_reported",
      "data": {
        "attempt_id": "2174c9ea-5d90-428e-b849-a912f5f21f79",
        "effect_id": "sha256:d19d83b15e0ec164f3da356fe7a1ecef64734724d7fd65265e91e95f2ffe2829",
        "decision_id": "cdc218d9-cd8f-44ac-a786-8d4a1f28eec1",
        "started_at": "2026-10-05T19:00:00+00:00",
        "status": "attempted",
        "acknowledgement": {},
        "error": null
      }
    },
    {
      "record_id": "control-plane-bounded-run@28350065:control_plane_attempt_transition:3",
      "producer_profile_id": "control-plane-bounded-run@28350065",
      "record_type": "control_plane_attempt_transition",
      "source_sequence": 3,
      "source_path": "attempts[1]",
      "recorded_at": "2026-10-05T19:00:00+00:00",
      "identifiers": {
        "run_id": "run-1",
        "attempt_id": "2174c9ea-5d90-428e-b849-a912f5f21f79",
        "effect_id": "sha256:d19d83b15e0ec164f3da356fe7a1ecef64734724d7fd65265e91e95f2ffe2829",
        "decision_id": "cdc218d9-cd8f-44ac-a786-8d4a1f28eec1"
      },
      "evidence_class": "producer_reported",
      "data": {
        "attempt_id": "2174c9ea-5d90-428e-b849-a912f5f21f79",
        "effect_id": "sha256:d19d83b15e0ec164f3da356fe7a1ecef64734724d7fd65265e91e95f2ffe2829",
        "decision_id": "cdc218d9-cd8f-44ac-a786-8d4a1f28eec1",
        "started_at": "2026-10-05T19:00:00+00:00",
        "status": "acknowledged",
        "acknowledgement": {
          "moltbot_safe_status": "executed",
          "attempt_id": "7f6ffdfc-bb94-4b86-bf7e-8dd882783959",
          "newly_executed": true,
          "observation": {
            "effect_id": "sha256:d19d83b15e0ec164f3da356fe7a1ecef64734724d7fd65265e91e95f2ffe2829",
            "state": "applied",
            "destination_state": {
              "effect_id": "sha256:d19d83b15e0ec164f3da356fe7a1ecef64734724d7fd65265e91e95f2ffe2829",
              "grant_id": "urn:cognous:grant:routine-1",
              "target": "urn:cognous:synthetic-account:customer-001",
              "amount": 50.0,
              "unit": "USD",
              "payload": {
                "customer_id": "customer-001",
                "refund_reason": "duplicate"
              },
              "operation_digest": "sha256:ffcad4c587ea3a81df49e9b2c5d3ee817a929d07356d8704db82c1b9c70af175"
            }
          }
        },
        "error": null
      }
    },
    {
      "record_id": "control-plane-bounded-run@28350065:effect_observation:4",
      "producer_profile_id": "control-plane-bounded-run@28350065",
      "record_type": "effect_observation",
      "source_sequence": 4,
      "source_path": "observations[0]",
      "recorded_at": "2026-10-05T22:44:45.154659+00:00",
      "identifiers": {
        "run_id": "run-1",
        "effect_id": "sha256:d19d83b15e0ec164f3da356fe7a1ecef64734724d7fd65265e91e95f2ffe2829"
      },
      "evidence_class": "producer_reported",
      "data": {
        "effect_id": "sha256:d19d83b15e0ec164f3da356fe7a1ecef64734724d7fd65265e91e95f2ffe2829",
        "observed_at": "2026-10-05T22:44:45.154659+00:00",
        "state": "applied",
        "destination_state": {
          "effect_id": "sha256:d19d83b15e0ec164f3da356fe7a1ecef64734724d7fd65265e91e95f2ffe2829",